"id","created_at","text","media_url"
"886875026162667522","2017-07-17 09:07:38","@tiger_tea I have a flight in Bergen on 22nd. A new one costs about £200 plus the extra cost of staying in Norway longer.",""
"886674728534122496","2017-07-16 19:51:43","I'm sorry for not giving a curated social media experience with only positive things.",""
"886673679391830016","2017-07-16 19:47:33","@RTWbike clearly I could have given up on Spain and stayed in a hotel instead. So, yes, the was another option.",""
"886673272502407168","2017-07-16 19:45:56","Hiding from millions of midges in my poorly anchored tent in a bog in a wood. There was no better option. No.",""
"886670229966860290","2017-07-16 19:33:51","@tiger_tea that's brave. I couldn't face a 200 km day this week.",""
"886621247228055552","2017-07-16 16:19:12","I'm in a very bad mood.",""
"886619993936449536","2017-07-16 16:14:13","If you are cycling in Norway, avoid Kristiansund and Ålesund unless you are happy to pay higher prices to get in and/or out of them.",""
"886618964222251008","2017-07-16 16:10:08","@proogs I didn't say you were at fault, Peter. I'm having a really bad day/week/month.",""
"886618704355766272","2017-07-16 16:09:06","Seriously Norway, I've had enough of this.",""
"886618528878612480","2017-07-16 16:08:24","@RTWbike Why does the ferry timetable booklet list this not-a-ferry then? Why list it with the wrong price?",""
"886618212959490050","2017-07-16 16:07:09","@RTWbike Cest nes pas un ferry.",""
"886618035255169024","2017-07-16 16:06:26","@proogs you had a chance 30 minutes ago. Unlikely enough bandwidth now.",""
"886617834993967110","2017-07-16 16:05:39","@RTWbike ""This isn't a ferry"" said the ticket seller. ""This is a passenger boat"".",""
"886617431527084032","2017-07-16 16:04:02","The man at the campsite gave me a ferry timetable that had prices. Great. Finally. But it lies. Just been charged 2.5 times what I expected.",""
"886611941019570177","2017-07-16 15:42:13","@sarahkendrew I don't have much choice on my budget and schedule.",""
"886609610643210241","2017-07-16 15:32:58","Well that's Twitter full of #doctorwho spoilers.",""
"886609351288528896","2017-07-16 15:31:56","@tiger_tea Which one did you choose?",""
"886608769484034049","2017-07-16 15:29:37","I can't wait to get to Scotland. I'll be able to afford simple things.",""
"886607983354011649","2017-07-16 15:26:30","The tourist office videos showing flybys of Ålesund look stunning. I'm wet, exhausted, with a breaking bike. I just want to leave.",""
"886594867798970368","2017-07-16 14:34:23","What to do? Staying here to go kms backwards to a bike shop loses me time I *will* have to make up. Going on means unknown kms to bike shop.",""
"886594176619614208","2017-07-16 14:31:38","@tiger_tea is the nearest bike shop south of me only a day away? Can I make up the lost time? Should I stay here and go backwards?",""
"886592870899232768","2017-07-16 14:26:27","@tiger_tea clearly something is proving too much. I wish I knew what.",""
"886592685926223872","2017-07-16 14:25:43","@tiger_tea no idea",""
"886591383007580162","2017-07-16 14:20:32","Just outside of Ålesund and my rear wheel rim has cracked. Again. It is a Sunday. :(",""
"886355276147953665","2017-07-15 22:42:20","In bar chart form https://t.co/wjV7N227xM https://t.co/2hn843WLqr","http://pbs.twimg.com/media/DEz3aq5W0AAZu9a.jpg"
"886336805745950721","2017-07-15 21:28:56","This is what my code (that I wrote from my phone so may be buggy) calculated as the altitude gains https://t.co/s3I5MCSXWY","http://pbs.twimg.com/media/DEzmnj7XoAA1IUj.jpg"
"886335379695120384","2017-07-15 21:23:16","That might be why I'm tired.",""
"886335211889405952","2017-07-15 21:22:36","I think that's about 5 times the height of Everest.",""
"886334596958355456","2017-07-15 21:20:09","It seems I've done about 45 km of altitude gain since Kirkenes on 17th June. 🚲",""
"886333161810137088","2017-07-15 21:14:27","I think I've worked out my daily height gains https://t.co/haWV1kLU6G",""
"886319721708236800","2017-07-15 20:21:03","A write-up of yesterday: https://t.co/XdOHAD56uM",""
"886319455046963200","2017-07-15 20:19:59","A write-up of Thursday: https://t.co/pb4G6a2Rex",""
"886319074183086080","2017-07-15 20:18:28","@chrisenorth It is raining right now as I lay in my tent. ☔",""
"886284155344080896","2017-07-15 17:59:43","RT @Conscious_Bob: @RTWbike Very nice, it's a moth, Six Spot Burnet.",""
"886267799915696128","2017-07-15 16:54:44","@chrislintott I am looking forward to finally getting a rest day after Bergen (22 July). Last break was in Tromsø o… https://t.co/Kx5NNyrekQ",""
"886266644632408065","2017-07-15 16:50:08","@chrislintott It is ""easy"" to get Eddington = 85 if you cycle around flat countryside. ;) Norway is a little harder.",""
"886266054435098628","2017-07-15 16:47:48","@chrislintott It was over 50 last time I checked. I've been thinking there should be a metric version too. Also, on… https://t.co/p8nxFcpicI",""
"886265472089509888","2017-07-15 16:45:29","Near Midsund https://t.co/svnc71Yo3l","http://pbs.twimg.com/media/DEyls8nXcAEKPpY.jpg"
"886265173144731649","2017-07-15 16:44:17","A very mountainy mountain. 🗻 https://t.co/mtqi7RREaT","http://pbs.twimg.com/media/DEylZjQXgAI8FFe.jpg"
"886264630129119232","2017-07-15 16:42:08","Another 15-20km detour to progress 1km across the end of a fjord. It was pretty though. https://t.co/ba07Z0nGxc","http://pbs.twimg.com/media/DEyk78DXoAICpmd.jpg"
"886264089143627779","2017-07-15 16:39:59","The view from Bud. https://t.co/GmzDXB9hQG","http://pbs.twimg.com/media/DEykefRXoAAS2HO.jpg"
"886263920440246272","2017-07-15 16:39:19","Gender stereotyping. https://t.co/oKImidv4K8","http://pbs.twimg.com/media/DEykSmwWsAUjYzB.jpg"
"886263631117201409","2017-07-15 16:38:10","Flowers by the road https://t.co/QydodhHgIi","http://pbs.twimg.com/media/DEykCD5XoAEWhvP.jpg"
"886263391945449472","2017-07-15 16:37:13","Had another dip in the Atlantic on this sandy beach. 🚲 https://t.co/qvrmcDiz0o","http://pbs.twimg.com/media/DEyj0I1W0AEAjy9.jpg"
"886263048469663746","2017-07-15 16:35:51","Not such what my H index is up to these days but my Vindex is 0.8. ;) https://t.co/xbZRU4AIQA","http://pbs.twimg.com/media/DEyjdqtW0AAhwsF.jpg"
"886262614610849793","2017-07-15 16:34:07","A farmer beckoned me over for a chat. His family left Scotland in the 18th century. 🚲 https://t.co/RTCcngA8jJ","http://pbs.twimg.com/media/DEyi_ucXUAA5_0L.jpg"
"886262042193276928","2017-07-15 16:31:51","Anyone know what insect this was that sat on my tent all night? Had to encourage it off this morning to pack the te… https://t.co/Qj0L9e4Vuk",""
"886261554227941378","2017-07-15 16:29:55","@tiger_tea Yep",""
"885960461774094337","2017-07-14 20:33:29","Rullekake and tea by the ocean at 10pm. https://t.co/nmnWomUwpG","http://pbs.twimg.com/media/DEuPY4OW0AAn7zt.jpg"
"885959586045448192","2017-07-14 20:30:00","Wild camping by the Atlantic Highway 🚲 ⛺ https://t.co/oSPLrBhg6z","http://pbs.twimg.com/media/DEuO15MXoAIGkq8.jpg"
"885958761738887169","2017-07-14 20:26:43","🚲 with the Atlantic https://t.co/9RuKWbb4Ce","http://pbs.twimg.com/media/DEuOQY8WAAEoAeZ.jpg"
"885957711061504000","2017-07-14 20:22:33","Atlantic Highway ☀ https://t.co/37gATnvaCT","http://pbs.twimg.com/media/DEuNwYKXgAAhb5q.jpg"
"885937810053763073","2017-07-14 19:03:28","Finally hit the Atlantic Highway. The sun is out. I pitched my tent next to the peaceful ocean. I want to savor this moment.",""
"885871082074497024","2017-07-14 14:38:19","I'm just annoyed at how difficult it is to anticipate random costs in Norway. Apparently it only costs a car 100 krones to get through.",""
"885870477851471873","2017-07-14 14:35:55","A very kind lady from Lithuania paid for my 85 krones (as it turned out) bus fare through the tunnel.",""
"885862793576165376","2017-07-14 14:05:23","@RTWbike I had to pay £4 to get to Kristiansund by ferry. No money left for anything else now. :(",""
"885862494052528128","2017-07-14 14:04:11","@RTWbike ”the bus isn't expensive"" the bus station said then told me it might be 91 krones. £9 to leave! There is no alternative south.",""
"885862058486575105","2017-07-14 14:02:27","I am trapped in Kristiansund. I have to take a bus through the tunnel to leave. There is no proper tourist information office or it's hidden",""
"885861620693553152","2017-07-14 14:00:43","I am tired of nobody in Norway knowing how much ferries or buses will cost. Even at the dock there are no prices. They say to look online.",""
"885778590071218176","2017-07-14 08:30:47","@RTWbike So, if you see someone homeless today, please help them out.",""
"885773982963781632","2017-07-14 08:12:29","@RTWbike oh and I can't use my solar panels to charge my phone (that drains its battery at an increasing rate).",""
"885772352960823296","2017-07-14 08:06:00","@RTWbike Yesterday I had managed to dry my shoes overnight. They were soaked again within 30 mins. My feet look awful at the end of 10 hrs.",""
"885771825296363520","2017-07-14 08:03:54","@RTWbike So rain is nice. But no proper break from it means it slowly saps away all my energy or money.",""
"885771302702915585","2017-07-14 08:01:50","@RTWbike This morning I reached into my food bag (blindly) and pulled out a huge slug curled up in a ball like a half eaten plum. Urgh.",""
"885770704519671808","2017-07-14 07:59:27","@RTWbike On previous trips I could hand wash and let things dry in the sun. As I can't do that everything gets damp and even smellier.",""
"885770127890841600","2017-07-14 07:57:09","@RTWbike With no long gap in the rain I can't dry anything. Well, I could if I spent 60% of my daily budget on laundry. Food comes first.",""
"885769503535243264","2017-07-14 07:54:41","@RTWbike Everything I'm wearing ends up dripping. I have to put those cold damp clothes on in the morning to start the next day.",""
"885769079117762562","2017-07-14 07:52:59","@RTWbike It soaks me through even in waterproofs because of the sweat going up all the hills. At 64 degrees north it is cold so saps energy.",""
"885768498059911168","2017-07-14 07:50:41","So why does the rain matter to me? Surely it is just some rain?",""
"885758032092778496","2017-07-14 07:09:06","@Jonny75boy Near Aure, Norway.",""
"885592415574405120","2017-07-13 20:11:00","@Conscious_Bob Actually, Marte gave me a whole plate of cakes.",""
"885592118303088640","2017-07-13 20:09:49","It's 10pm &amp; the light is fading. Is this the ""night"" I vaguely remember? I'm going to have to get used to life below the Arctic Circle again",""
"885590761353465856","2017-07-13 20:04:25","@Conscious_Bob I give them the edge because they didn't know I was coming.",""
"885590071373705216","2017-07-13 20:01:41","RT @liz_dodd: Brief WiFi window in the Serbian hills: views: breathtaking, legs: just about surviving 😂, Carpathians: summited https://t.co…",""
"885588024268075009","2017-07-13 19:53:33","I can't help but think more people need to share food with someone they've just met from another country half way up a mountain in the rain.",""
"885586471666823168","2017-07-13 19:47:22","Although all the rain leaves me nearly always soaked through, it can be atmospheric. ☔ https://t.co/cozZM3MwUk","http://pbs.twimg.com/media/DEo6rgJXYAEsTV5.jpg"
"885585369835724800","2017-07-13 19:43:00","Gabin, who cycled from France. I made him a fried egg and he made me a coffee. https://t.co/Si9QEXq6Lb","http://pbs.twimg.com/media/DEo5tBcXoAAwsiK.jpg"
"885584306831331328","2017-07-13 19:38:46","Going uphill after Kyrksæterøra. https://t.co/4CWTtr8YBb","http://pbs.twimg.com/media/DEo47-8XcAM-j9w.jpg"
"885582540333035520","2017-07-13 19:31:45","Hugo, from Belgium, who has cycled in many countries but is fed up of the rain in Norway. https://t.co/rnHVPiC9pX","http://pbs.twimg.com/media/DEo3fRpXoAAroqo.jpg"
"885489902527369220","2017-07-13 13:23:39","RT @JoffSummerfield: View over the Grand Canyon. 2014.\n#pennyfarthing https://t.co/kLriJ5DKbq","http://pbs.twimg.com/media/DEmtBwUXkAA7TE_.jpg"
"885489601883852800","2017-07-13 13:22:27","It is amazing the difference a genuinely friendly person at a tourist information office can make to my trip. They can cheer up a rainy day.",""
"885488987913302016","2017-07-13 13:20:00","Kyrksæterøra joins Tromsø, Osijek (Croatia), Oberkirch (Germany), and Batavia (New York) in my world rankings for friendly Tourist Offices 🙂",""
"885487772093607938","2017-07-13 13:15:11","I think I've found a new winner for the friendliest Tourist Information office in Norway. Thanks Marte for the coff… https://t.co/noUMNTTnRq",""
"885237514965057536","2017-07-12 20:40:45","I would love to know my total altitude per day (how much uphill). Don't quite have enough battery to code something up from my phone.",""
"885235798945214466","2017-07-12 20:33:56","I'll reach the 1500 mile mark tomorrow. https://t.co/doYLrUrvqn",""
"885235233431441408","2017-07-12 20:31:41","Write-up of today: Don't look back Orkanger https://t.co/ZUmxNbbFfI",""
"885234945278582784","2017-07-12 20:30:32","Write-up of yesterday: A day of big climbs https://t.co/vY85FCZl3Z",""
"885130996085129216","2017-07-12 13:37:29","Getting there. 10 days to Bergen https://t.co/sIx5IRTq76 https://t.co/DmXHZaWldz","http://pbs.twimg.com/media/DEid8QfXsAE7X2T.jpg"
"885123375122837505","2017-07-12 13:07:12","Bit of a rainy day today https://t.co/84iwkNDuLk","http://pbs.twimg.com/media/DEiW7mJXgAAfkpA.jpg"
"885061164077637632","2017-07-12 08:59:59","Ferry++",""
"885027840617586688","2017-07-12 06:47:34","@yogarhona yes. An Ethernet cable to plug into your router.",""
"884865838922248192","2017-07-11 20:03:50","No, I haven't strayed into the US. This is near Austråt. https://t.co/Mb7LnqJy8q","http://pbs.twimg.com/media/DEeruKPXcAUf5F5.jpg"
"884864200388096001","2017-07-11 19:57:20","If you are wondering where I've got on my 🚲, about here: https://t.co/RFDh379SnZ",""
"884863922788069378","2017-07-11 19:56:13","A field of wheat near Brekstad. \n🌾 🌾 🌾 https://t.co/fiyMXPAY1e","http://pbs.twimg.com/media/DEepxO6XgAAkJmz.jpg"
"884862821296680960","2017-07-11 19:51:51","Fjord view near Botngård this evening. https://t.co/sqHV4Dnecs","http://pbs.twimg.com/media/DEepOIqWsAA9Ulk.jpg"
"884861755188535296","2017-07-11 19:47:37","Looking back down the fjord whilst climbing up one of today's hills 🚲 https://t.co/VYaHxr85DX","http://pbs.twimg.com/media/DEeoJgxXkAQaqSZ.jpg"
"884861416297029633","2017-07-11 19:46:16","Friendly man running Osen Fjordcamping. Gave me some helpful advice about the hills I'd face today. Also suggested… https://t.co/KjUY0KFL6H",""
"884860264964694016","2017-07-11 19:41:41","Friendly Swedish couple. There are fewer non-Norwegian tourists in this part of Norway. https://t.co/oKhttZO6c5","http://pbs.twimg.com/media/DEem4IuXkAI_IaX.jpg"
"884858985349885952","2017-07-11 19:36:36","Thistles in the sun. 🚲 https://t.co/x3hi4kPBf8","http://pbs.twimg.com/media/DEelm62XoAESArD.jpg"
"884857640341340165","2017-07-11 19:31:15","Yesterday afternoon https://t.co/kN78LmYzwK","http://pbs.twimg.com/media/DEekkPEXgAEWDv7.jpg"
"884855889433423872","2017-07-11 19:24:18","Glad the nice folks at @Livoniaparkrun got a mention. They were lovely when I visited during my cross-US cycle. https://t.co/jjxIPZXVT8",""
"884519750377889793","2017-07-10 21:08:36","I make it 15 ferries I've been on now. I've covered 2154 km including today's 115 km.",""
"884519267542204416","2017-07-10 21:06:41","A write-up of yesterday https://t.co/NohMdmoOBs",""
"884495684858236933","2017-07-10 19:32:59","RT @wkrslunchtime: Just had bike nicked outside @leedsmusic @bbcleeds @KendellsBistro @EstabuloLeeds between 5.15 &amp; 6.15. CCTV appreciated.…",""
"884433972972965890","2017-07-10 15:27:45","Perhaps I should post pictures of my feet to give you all nightmares.",""
"884433463943847936","2017-07-10 15:25:44","OK. I'm doing the longer route despite being exhausted. Please give money to @MSF_uk https://t.co/KohIMIW8v3",""
"884432677415374848","2017-07-10 15:22:36","The disadvantage of regaining the Internet is that I see my planned route to Trondheim is longer than the one I came up with this morning",""
"884419300047585281","2017-07-10 14:29:27","Now I'm in a mix of sun and showers that needs sun cream and full waterproofs. https://t.co/pYRAAAnA36","http://pbs.twimg.com/media/DEYWnltW0AA1vMn.jpg"
"884418895620263936","2017-07-10 14:27:51","Sure it was sunny yesterday evening but then the rain started again during the night. https://t.co/GWtpJTuFva","http://pbs.twimg.com/media/DEYWNHnWAAAnS1j.jpg"
"884418455323250688","2017-07-10 14:26:06","Head net required https://t.co/3cBuZoOz6d","http://pbs.twimg.com/media/DEYV37dWsAA7P4s.jpg"
"884418303275544577","2017-07-10 14:25:29","It was a beautiful spot to camp. The downside were the thousands of midges that waited for me to put up my tent bef… https://t.co/zNyW8tbmbh",""
"884417739762405380","2017-07-10 14:23:15","I camped here last night https://t.co/u7xt3bWEef","http://pbs.twimg.com/media/DEYVOwWXYAAqkpQ.jpg"
"884417509063053314","2017-07-10 14:22:20","There was a restaurant called Kro. Reminds me of Manchester. https://t.co/NeJtG5oj1x","http://pbs.twimg.com/media/DEYU_vAXkAEjBsk.jpg"
"884417222202068992","2017-07-10 14:21:12","Sunny panorama https://t.co/8S8DHCTSJx","http://pbs.twimg.com/media/DEYUwg7XUAEP-PN.jpg"
"884416996296859648","2017-07-10 14:20:18","It got brighter after Lünd https://t.co/Syag8BIazK","http://pbs.twimg.com/media/DEYUhWpXYAA9y2Y.jpg"
"884416790272626690","2017-07-10 14:19:29","Taking the ferry from Hofles to Lünd. https://t.co/UqDVeYJNxN","http://pbs.twimg.com/media/DEYUU2rXgAEVMHE.jpg"
"884416511821008896","2017-07-10 14:18:22","Looking down to Kolvereid https://t.co/evhmEi6n4Q","http://pbs.twimg.com/media/DEYUFPkXUAAI0SP.jpg"
"884416112473108483","2017-07-10 14:16:47","I only talked to them briefly because we were mobbed by midges.",""
"884415918805331968","2017-07-10 14:16:01","Ava and Rudi from Switzerland https://t.co/EvC56j2rlD","http://pbs.twimg.com/media/DEYTiV2XYAED8pR.jpg"
"884415636725784576","2017-07-10 14:14:54","More rainy Norway https://t.co/2HHE4jgOKj","http://pbs.twimg.com/media/DEYTRaeXkAE0frv.jpg"
"884415415912472576","2017-07-10 14:14:01","Rainy Norway https://t.co/pBGLOPatsS","http://pbs.twimg.com/media/DEYTEa2XoAAjq78.jpg"
"884403872919425029","2017-07-10 13:28:09","Enough of the rain Norway. I want dry feet.",""
"884403666823909376","2017-07-10 13:27:20","Problem wasn't battery but USB cable. Ughh.",""
"884403363298910208","2017-07-10 13:26:07","@chrisenorth I think my phone does some kind of stabilisation.",""
"883663464035733505","2017-07-08 12:26:02","Ok. That's me for today. Off to see Torghatten.",""
"883663061399351296","2017-07-08 12:24:26","Here's a vlog riding towards Tjøtta https://t.co/wr8nivC2a7",""
"883660978189107201","2017-07-08 12:16:09","A short little walk from the edge of the road yesterday afternoon https://t.co/mhDMJsJRnp",""
"883659194334924800","2017-07-08 12:09:04","This is a bus stop. https://t.co/zaokd5JF1W","http://pbs.twimg.com/media/DENjU2LW0AAgfFl.jpg"
"883658798782713856","2017-07-08 12:07:29","Flowers by the side of the road 🚲 🌸 https://t.co/paPPNvC4VX","http://pbs.twimg.com/media/DENi9uHXoAYWNts.jpg"
"883658583497486336","2017-07-08 12:06:38","Waiting for the ferry to Horn. https://t.co/NPJ4Ggz1YH","http://pbs.twimg.com/media/DENiw8AWsAEcooZ.jpg"
"883658329574318080","2017-07-08 12:05:38","Stayed at a campsite last night. The view from my tent. https://t.co/J90D9p7m3E","http://pbs.twimg.com/media/DENiicuXYAAqoAh.jpg"
"883658022006009856","2017-07-08 12:04:24","Views from the ferry from Tjøtta to Forvik https://t.co/FrgjpD0hYd","http://pbs.twimg.com/media/DENiPvtXoAEdrAi.jpg"
"883657583818665986","2017-07-08 12:02:40","Islands https://t.co/19TXdg6CJn","http://pbs.twimg.com/media/DENh3HGXcAISj_M.jpg"
"883657249171939328","2017-07-08 12:01:20","Start of the Seven Sisters from the south east. https://t.co/VII3vpBAj6","http://pbs.twimg.com/media/DENhjruXUAE2fIL.jpg"
"883656869415444480","2017-07-08 11:59:49","The tide was out https://t.co/HW8r4Y67xO","http://pbs.twimg.com/media/DENhNIyXYAEqzMv.jpg"
"883656501155573760","2017-07-08 11:58:22","End of the Seven Sisters. https://t.co/XRHDKw9koF","http://pbs.twimg.com/media/DENg4HmXkAAVruH.jpg"
"883656303343742976","2017-07-08 11:57:34","Church and sun. https://t.co/g4qLo0aKXC","http://pbs.twimg.com/media/DENgsw1WsAADXtq.jpg"
"883656109768290304","2017-07-08 11:56:48","Another view of the Seven Sisters. https://t.co/txzP4POFpw","http://pbs.twimg.com/media/DENghVQXsAE1jVW.jpg"
"883655761930407937","2017-07-08 11:55:25","Coast of Helgeland 🚲 https://t.co/YE5gmWQBVs","http://pbs.twimg.com/media/DENgNAOXoAE9ynW.jpg"
"883655533722468353","2017-07-08 11:54:31","A glimpse of the Seven Sisters yesterday. https://t.co/jO9c5bjTsp","http://pbs.twimg.com/media/DENgAAAXcAAKi0_.jpg"
"883654960294096899","2017-07-08 11:52:14","@zemogle Thanks for sending the good weather up here yesterday.",""
"883299116490665984","2017-07-07 12:18:14","A short clip riding on the Helgelandbrau with Claudia (from Germany) who I bumped into again: https://t.co/NM2B5vZHXL",""
"883298367425708033","2017-07-07 12:15:16","A rather shaky video riding along the Helgeland coastline. https://t.co/KSbp3NDRKc",""
"883296428067627008","2017-07-07 12:07:33","Summary from Bodø: rain, fjords, rain, some sun, fjords, rain, rain, sun. I would like dry feet for at least 24 hours.",""
"883295911656525826","2017-07-07 12:05:30","@Yodatheoak Don't really know. Pretty sure I've reached freezing. It can be warm in the sun and a few degrees in the shade.",""
"883295578565865472","2017-07-07 12:04:11","Sunshine! This must be the day they take the photos for the tourist brochures. https://t.co/XDtzB9tvIg","http://pbs.twimg.com/media/DEIYnxrWsAIxTjE.jpg"
"883294913068138498","2017-07-07 12:01:32","Better weather this morning. I ended up cycling with Claudia from Levang to Sandnessjøen. https://t.co/agQJGHJbYi","http://pbs.twimg.com/media/DEIYA-OXUAI5kNe.jpg"
"883294471273709568","2017-07-07 11:59:47","Camp spot last night before the rain set in. Again. https://t.co/vbdssH9vpl","http://pbs.twimg.com/media/DEIXmsXW0AEgHR-.jpg"
"883294203601616898","2017-07-07 11:58:43","Between the mountains and the clouds. 🚲 https://t.co/XLgMEIJqYd","http://pbs.twimg.com/media/DEIXXCfXkAAs7WA.jpg"
"883293409976487936","2017-07-07 11:55:34","Slowly cycling uphill towards 340m. https://t.co/oL5FB5YNYu","http://pbs.twimg.com/media/DEIWqfMXkAAyPQs.jpg"
"883293125443284993","2017-07-07 11:54:26","The end of the sunshine yesterday. https://t.co/7qhWLs8Vpi","http://pbs.twimg.com/media/DEIWYl3WsAAAA_7.jpg"
"883292839806992384","2017-07-07 11:53:18","Steps to the sea. https://t.co/ety6lPoQUm","http://pbs.twimg.com/media/DEIWH44XcAA5Uk0.jpg"
"883292602937880577","2017-07-07 11:52:21","Low cloud and showers today. https://t.co/XG0By8MQuv","http://pbs.twimg.com/media/DEIV6gvXoAAkwJZ.jpg"
"883292341917949952","2017-07-07 11:51:19","Flowers and fjord. https://t.co/bkyFLf9BDT","http://pbs.twimg.com/media/DEIVq_fXYAQD8Vq.jpg"
"883292144928247808","2017-07-07 11:50:32","The village of ""Aas"" were clearly trying to get at the start of the A-Z index. https://t.co/TR8l7UW7A0","http://pbs.twimg.com/media/DEIVfkmXcAEuol5.jpg"
"883291555464925184","2017-07-07 11:48:12","Mirror fjords. https://t.co/HY1Vio0DvU","http://pbs.twimg.com/media/DEIU6gYXsAAmTif.jpg"
"883291194649964544","2017-07-07 11:46:46","The sun was taunting me. It started raining again during the night. https://t.co/V3fXSZsQ5a","http://pbs.twimg.com/media/DEIUoMSXkAEXYDM.jpg"
"883290872611254272","2017-07-07 11:45:29","Italians at my camping spot two nights ago. https://t.co/UxTs2v5qbv","http://pbs.twimg.com/media/DEIUVraXUAAir-s.jpg"
"883290408746442754","2017-07-07 11:43:38","Beautiful even in the rain. https://t.co/1K7LAQkOto","http://pbs.twimg.com/media/DEIT6z8WAAANlCD.jpg"
"883290192915968004","2017-07-07 11:42:47","Another ferry ride https://t.co/2mYhgjGEF4","http://pbs.twimg.com/media/DEITubgXcAAjRW-.jpg"
"883289806360514560","2017-07-07 11:41:15","Norway trying to resemble the ups and downs of the rolling river valleys of Iowa. https://t.co/5qrfdpzOLx","http://pbs.twimg.com/media/DEITXiJXcAA8Rcn.jpg"
"883289389371199488","2017-07-07 11:39:35","It is always sunnier on the other side of the fjord. 🚲 https://t.co/mAdelsmKc6","http://pbs.twimg.com/media/DEIS_GdWAAAZxf0.jpg"
"883289150715297794","2017-07-07 11:38:38","The mountains still have snow in July https://t.co/Ijx4quBMXT","http://pbs.twimg.com/media/DEISwmAXoAA3dQN.jpg"
"883288900621488129","2017-07-07 11:37:39","Staying on the edge of the sun and rain. https://t.co/GrsNoUCguU","http://pbs.twimg.com/media/DEISiynXgAAtyHB.jpg"
"883288733558222848","2017-07-07 11:36:59","Ready for two days of photos?",""
"883288381396066304","2017-07-07 11:35:35","@Yodatheoak Yes. I tried that.",""
"883287822324703232","2017-07-07 11:33:22","As a result I am now unable to communicate except on WiFi. As you might imagine, few fjords have WiFi.",""
"883287388356825096","2017-07-07 11:31:38","Phone that takes my Internet sim died. The battery will not recharge. It has given up the ghost. It is an ex-battery.",""
"883286883618443265","2017-07-07 11:29:38","@Yodatheoak I hope so! Got a flight to catch on 22nd.",""
"882906664277618690","2017-07-06 10:18:47","I've left the Arctic Circle. (Best I could do in the rain, cold, and on a moving ferry) https://t.co/rIwN39qPJ1","http://pbs.twimg.com/media/DEC1qMJWsAAE-LD.jpg"
"882894521377460224","2017-07-06 09:30:31","@astrofrog @chrisenorth I can't work them all out, and signs, so I'll say I was ""most horizontal"" as I was asleep through the likely times.",""
"882894121421205504","2017-07-06 09:28:56","@astrofrog @chrisenorth Last night was probably the closest. There'll be corrections for longitude, offset from equinox, summer time.",""
